title,description,url,source,published_at
صور سيلفي مع سيزر - أحدث ألعاب تيكفيل ونهاية اللحظة,"وصل الجهاز دون أي مراسم رسمية. قرص صغير يُصدر طنينًا، يشبه مرآة جيب، مُحاطًا بجسم غريب، وتعليمة واحدة: ""أشر، ضع، اختر أيقونتك"". في غضون 48 ساعة، جنّ جنون تيكفيل. يستخدم الجهاز الجديد، المعروف باسم EGO-Snap فقط، تقنية التصوير الفوتوغرامتري المتقدمة المدعومة بالذكاء الاصطناعي، وتقنية توليف الوجوه بالتعلم العميق، وتجاهلًا واضحًا للتاريخ.",https://www.arabnews.com/node/2614976,أخبار العرب,2025-09-11T22:23:00Z
Craft Silicon وMindHYVE.ai تعقدان شراكة استراتيجية لنشر الذكاء الاصطناعي الوكيل في القوى العاملة وأنظمة التعليم في إفريقيا,"نيروبي، كينيا ونيوبورت بيتش، كاليفورنيا، 12 سبتمبر/أيلول 2025 / بي آر نيوزواير/ -- أعلنت شركة كرافت سيليكون المحدودة، وهي شركة عالمية رائدة في مجال ابتكارات التكنولوجيا المالية ومقرها نيروبي، وشركة مايند هايف.اي، إنك، الرائدة في مجال الذكاء الاصطناعي الوكيل (AGI)، عن مذكرة تفاهم لتقديم ArthurAI™، وهي منصة تعليم ذاتي من الجيل التالي، إلى الأسواق الأفريقية. **media[745238]**",https://www.manilatimes.net/2025/09/12/tmt-newswire/pr-newswire/craft-silicon-and-mindhyveai-forge-strategic-partnership-to-deploy-agentic-ai-across-africas-workforce-and-education-systems/2183225,صحيفة مانيلا تايمز,2025-09-11T22:08:15Z
Turbolearn AI: مستقبل الذكاء الاصطناعي وأدوات الدراسة للتعلم الأكثر ذكاءً,"يُعيد الذكاء الاصطناعي تشكيل طريقة عيشنا وعملنا وتعلمنا. ففي مجال التعليم، تُحوّل المنصات المُدعّمة بالذكاء الاصطناعي أساليب الدراسة التقليدية إلى تجارب تعليمية ذكية ومُخصّصة. ومن بين هذه الابتكارات، يبرز Turbolearn كأداة دراسية فعّالة مُصمّمة لمساعدة الطلاب والمعلمين والمتعلمين مدى الحياة على الدراسة بذكاء، لا بجهد أكبر. ما هو Turbolearn AI؟ Turbolearn […]",https://techbullion.com/turbolearn-ai-the-future-of-ai-study-tools-for-smarter-learning/,تك بوليون,2025-09-11T18:58:57Z
كيف يشكل الذكاء الاصطناعي والتعلم الآلي مستقبل تطبيقات الهاتف المحمول,"نيودلهي [الهند]، ١١ سبتمبر: غيّرت تطبيقات الهاتف المحمول أسلوب حياتنا بالفعل، لكن الذكاء الاصطناعي والتعلم الآلي يُحدثان ثورةً في تطبيقات الهاتف المحمول نفسها، ويجعلانها أكثر ذكاءً وتخصيصًا للمستخدمين. من روبوتات الدردشة المدعومة بالذكاء الاصطناعي إلى التحليلات التنبؤية، تُساعد هذه التقنيات الشركات على تحسين وظائف التطبيقات، وتعزيز تفاعل المستخدمين، وتقديم تجربة سلسة.",https://www.tribuneindia.com/news/business/كيف يُشكل الذكاء الاصطناعي والتعلم الآلي مستقبل تطبيقات الهاتف المحمول؟,صحيفة تريبيون,2025-09-11T08:35:24Z
كيف يشكل الذكاء الاصطناعي والتعلم الآلي مستقبل تطبيقات الهاتف المحمول,"كيف تعمل الذكاء الاصطناعي والتعلم الآلي على تشكيل مستقبل تطبيقات الهاتف المحمول - PNN نيودلهي [الهند]، 11 سبتمبر: لقد غيرت تطبيقات الهاتف المحمول بالفعل طريقة حياتنا - ولكن الآن الذكاء الاصطناعي ... احصل على آخر الأخبار حول الأعمال فقط على lokmattimes.com",https://www.lokmattimes.com/business/كيف-يُشكل-الذكاء-الاصطناعي-والتعلم-الآلي-مستقبل-تطبيقات-الجوال/,لوكمات تايمز,2025-09-11T08:32:49Z
يقدم سوريا نارايانا تشاكا كتابه الرؤيوي الذي يتناول تطبيقات الذكاء الاصطناعي والتعلم الآلي لتحويل نظام تخطيط موارد المؤسسات,"سوريا نارايانا تشاكا: يشهد الاقتصاد الرقمي وتيرةً غير مسبوقة، مما يُجبر الشركات على تطوير أنظمتها التشغيلية ونهجها في إدارة سلسلة التوريد وعلاقات العملاء. ويتطلب المشهد التنافسي الحالي تطوير أنظمة تخطيط موارد المؤسسات (ERP) لتشمل الذكاء الاصطناعي والتعلم الآلي وميزات التحليلات التنبؤية، مما يُمكّن الشركات من البقاء […]",https://techbullion.com/سوريا-نارايانا-تشاكا-يقدم-كتابه-الرؤيوي-الذي-يتناول-تطبيقات-الذكاء-الاصطناعي-والتعلم-الآلي-في-تحويل-أنظمة-تخطيط-موارد-الموارد/,تك بوليون,2025-09-11T08:29:48Z
تمكين المعلمين: الكشف عن دور الذكاء الاصطناعي في الفصول الدراسية الحديثة,"يتطور الذكاء الاصطناعي في التعليم بسرعة، متجاوزًا جاهزية المدارس والجامعات الحالية. تنشر شبكات التعلم غير الرسمية معرفة الذكاء الاصطناعي بين الطلاب والمعلمين، لكنها تفتقر إلى العمق والتركيز على القضايا الأخلاقية. يُعدّ التطوير المهني المنظم للمعلمين أمرًا بالغ الأهمية لتعزيز المشاركة النقدية والتكامل الفعال للذكاء الاصطناعي.",https://www.devdiscourse.com/article/education/3623637-تمكين-المعلمين-كشف-دورهم-في-الفصول-الدراسية-الحديثة,ديف ديسكورس,2025-09-11T06:40:25Z
تمكين العقول: صعود الذكاء الاصطناعي في المناهج التعليمية,"نيودلهي [الهند]، ١٠ سبتمبر: يُعدّ مجال التعليم من أكثر مجالات الذكاء الاصطناعي تحوّلاً، إذ تُدرك المؤسسات التعليمية حول العالم إمكاناته الهائلة. فمن تجارب التعلم المُخصّصة إلى التقييمات المُدعّمة بالذكاء الاصطناعي، يُعيد الذكاء الاصطناعي تعريف كيفية توليد المعرفة وتقديمها واستيعابها. ولذلك، اعتمدت المؤسسات التعليمية أطراً متينة لدمج الذكاء الاصطناعي في مناهجها الدراسية، مما يضمن ليس فقط فهم الطلاب لخصائص هذه التقنية، بل أيضاً تعلّمهم كيفية تطبيقها أخلاقياً وفعالاً.",https://www.tribuneindia.com/news/business/تمكين-العقول-في-صعود-الذكاء-الاصطناعي-في-مناهج-التعليم/,صحيفة تريبيون,2025-09-10T04:50:17Z
PwC تطلق 'زميلًا' من الجيل AI لوظائف الضرائب,"مومباي، 9 سبتمبر: أطلقت شركة PwC الهند يوم الثلاثاء منصة ذكاء اصطناعي توليدي لمساعدة العملاء في المهام الضريبية والتنظيمية. وتُعرف المنصة باسم ""GenAI colleague"" لقسم الضرائب، وتُعرف باسم ""Navigate Tax Hub"". وتستفيد المنصة من الذكاء الاصطناعي المتقدم، وخبرة PwC الضريبية، وتكامل المستندات الآمن لتعزيز الكفاءة والدقة والقيمة لفرق الضرائب، وفقًا لبيان صادر عنها. وتهدف المنصة إلى تعزيز كفاءة قسم الضرائب، كما تساعد فرق الضرائب على أن تصبح أكثر فعاليةً وقيمةً مضافةً [...]",https://www.dailyexcelsior.com/pwc-launches-gen-ai-colleague-for-tax-functions/,إكسلسيور اليومي,2025-09-10T00:18:49Z
أوميش كومار: الذكاء الاصطناعي في التطوير السريري - تحويل البحث بالذكاء,"في ظل التطور السريع للتطورات السريرية، أصبح التكامل بين الذكاء الاصطناعي والتعلم الآلي معيارًا يُحتذى به. ويقود هذه الحركة أوميش كومار، مدير البرمجة الإحصائية المساعد في شركة IQVIA RDS (الهند) الخاصة المحدودة، الذي تُعيد رؤيته الثاقبة وبصيرته الثاقبة رسم آفاق جديدة في مجال الرعاية الصحية. يتمتع أوميش بخبرة عالمية تزيد عن 17 عامًا، وهو [...]",https://techbullion.com/umesh-kumar-ai-in-clinical-development-transforming-research-with-intelligence/,تك بوليون,2025-09-09T16:46:28Z
الذكاء الاصطناعي مفتاح تعزيز الأمن الغذائي من خلال تحليل الميكروبيوم,"استُخدمت خوارزميات التعلم الآلي للتنبؤ بتطور السرطان، وتحديد العلامات المبكرة لمرض باركنسون، وتقييم الأمراض المصاحبة مثل قصور القلب والاكتئاب، وذلك من خلال الجمع بين الميتاجينوميات وعلم الأيض. وتُهيمن الغابات العشوائية، وآلات المتجهات الداعمة، وشبكات الذاكرة طويلة المدى، ومجموعات تعزيز التدرج على هذا المجال، وغالبًا ما تُدمج مع تحليل المكونات الرئيسية لإدارة مجموعات البيانات عالية الأبعاد.",https://www.devdiscourse.com/article/technology/3617443-الذكاء-الاصطناعي-مفتاح-تعزيز-الأمن-الغذائي-من-خلال-تحليل-الميكروبيوم,ديف ديسكورس,2025-09-09T11:20:06Z
كيف يُشكل الذكاء الاصطناعي والأتمتة مستقبل إدارة الديون,"يشهد مشهد إدارة الديون تحولاً جذرياً، مبتعداً عن الأساليب التقليدية، التي غالباً ما تكون تدخلية، نحو استراتيجيات أكثر تطوراً وتفاعلاً وكفاءة. ويكمن جوهر هذا التطور في التكامل المتزايد للتكنولوجيا: الذكاء الاصطناعي، والتعلم الآلي، والأتمتة. تُبسط هذه التقنيات العمليات وتُعيد تعريف عملية حل الديون، مما يجعلها أكثر [...]",https://techbullion.com/كيف-يُشكل-الذكاء-والأتمتة-مستقبل-إدارة-الديون/,تك بوليون,2025-09-09T07:25:39Z
كيفية تطوير تطبيق AI Avatar Generator مثل Lensa AI؟,"يُعدّ تطبيق مُولّد الصور الرمزية بالذكاء الاصطناعي مشروعًا ناشئًا وتطويريًا رائدًا وشائعًا. يستخدم هذا التطبيق خوارزميات متطورة للذكاء الاصطناعي والتعلم الآلي لتحويل صور المستخدم إلى صور رمزية أصلية ومُخصّصة باستخدام شبكات عصبية لنقل الأنماط. الصور الرمزية التي تُنشئها الصور الرمزية، والتي تُقدّمها Lensa AI، عالية الجودة […]",https://techbullion.com/كيفية-تطوير-تطبيق-مولد-صور-رمزية-للذكاء-الاصطناعي-مثل-lensa-ai/,تك بوليون,2025-09-
